{
  "Schema": "rackcad-gate-contract/v1",
  "Unit": "I-65",
  "Gate": "F1",
  "TaskId": "F1-T2-CANTILEVER-SOURCE",
  "Objective": "F1 de I-65, segunda y ultima tarea (decisiones I-65 §10, CD-I65-F1-01): la FUENTE Cantilever del Structural Analysis Model segun la Proposal V3.1 congelada (D-04, D-05 con IDL-01..10, D-10, D-10b, D-12, D-13 y §15) y las concreciones CD-I65-F1-13..16 (decisiones I-65 §13), con el golden de REF-CANT-01 derivado a mano por el Coordinator en docs/initiatives/I-65-f1-ref-cant-01.md. Un unico archivo de produccion nuevo, src/RackCad.Application/Systems/Cantilever/CantileverStructuralModelSource.cs, que implementa la abstraccion neutral IStructuralModelSource de F1-T1 (verificada en 1692804a) a partir del CantileverLineDesign ya deserializado y del catalogo, resolviendo con CantileverLineResolver: idealizacion analitica de una estacion de una cara PositiveY, apoyos y supuestos, vector de peralte, cargas colocadas desde el archivo, diagnosticos de fuera de V1. Con el resto de F1-T1, de REF-CANT-01 y del archivo de cargas se obtiene un StructuralModel valido, determinista y con el golden derivado a mano. Pruebas nuevas en archivos NUEVOS de tests/RackCad.Tests/StructuralAnalysis/ con namespace RackCad.Tests y clases cuyo nombre empieza por StructuralAnalysisCantilever; fixtures del diseno y de las cargas bajo tests/RackCad.Tests/StructuralAnalysis/Fixtures/. NO incluye: el adaptador o paquete de RAM Elements ni la regla de ejes locales de RAM (F3), el comando del Plugin, la lectura del sobre, el volcado y el comparador (F4), cargas de OV (F5), analisis (F6), UI ni escritura de archivos.",
  "AuthorityRevision": "ff0c57c7125ae268bcb42b2d56c0d5255e9a69ed",
  "MainSha": "bb0d5522e8411f66a51fdfb3f1f0d0514b737453",
  "Authorities": [
    {
      "Path": "docs/initiatives/I-65-proposal-v3.1.md",
      "Section": "archivo completo (Frozen: yes); en especial D-04, D-05 (IDL-01..10 y REF-CANT-01), D-10, D-10b, D-12, D-13, §3 (INV-04, 05, 06, 07 y 09) y §15",
      "Class": "UNIT_DOC"
    },
    {
      "Path": "docs/initiatives/I-65-f1-ref-cant-01.md",
      "Section": "archivo completo",
      "Class": "UNIT_DOC"
    },
    {
      "Path": "docs/automation/decisions/I-65.md",
      "Section": "archivo completo (en especial §9, §10, §11, §12 y §13)",
      "Class": "UNIT_DOC"
    },
    {
      "Path": "docs/initiatives/I-65-interop-analisis-estructural.md",
      "Section": "archivo completo",
      "Class": "UNIT_DOC"
    },
    {
      "Path": "docs/initiatives/I-65-discovery.md",
      "Section": "archivo completo",
      "Class": "UNIT_DOC"
    },
    {
      "Path": "docs/automation/decisions/I-65-owner-decision-freeze-f1.original.txt",
      "Section": "archivo completo",
      "Class": "UNIT_DOC"
    },
    {
      "Path": "docs/adr/0050-interoperabilidad-analisis-estructural.md",
      "Section": "archivo completo",
      "Class": "UNIT_CHANGE"
    },
    {
      "Path": "AGENTS.md",
      "Section": "## Convenciones arquitectonicas (obligatorias)",
      "Class": "EXTERNAL"
    },
    {
      "Path": "docs/INITIATIVE_LIFECYCLE.md",
      "Section": "## 7. Gates funcionales",
      "Class": "EXTERNAL"
    },
    {
      "Path": "docs/AUTOMATION_PLAN.md",
      "Section": "## 16. Ejecución delegada bajo orden del Coordinator",
      "Class": "EXTERNAL"
    },
    {
      "Path": "docs/automation/agent-execution/README.md",
      "Section": "archivo completo",
      "Class": "EXTERNAL"
    },
    {
      "Path": "docs/automation/agent-execution/routing.md",
      "Section": "## 1. Clases de tarea y ## 4. Algoritmo",
      "Class": "EXTERNAL"
    },
    {
      "Path": "docs/initiatives/PROMPT_TEMPLATES.md",
      "Section": "## G. Delegación de ejecución",
      "Class": "EXTERNAL"
    },
    {
      "Path": "docs/adr/0009-identidad-guid-embebida-en-dwg.md",
      "Section": "archivo completo",
      "Class": "EXTERNAL"
    },
    {
      "Path": "docs/adr/0022-geometria-parametrica-de-secciones-estructurales.md",
      "Section": "archivo completo",
      "Class": "EXTERNAL"
    },
    {
      "Path": "docs/adr/0024-fundacion-cantilever-base-columna.md",
      "Section": "archivo completo",
      "Class": "EXTERNAL"
    },
    {
      "Path": "docs/adr/0025-brazo-cantilever-cuerpo-compuesto-y-conexion.md",
      "Section": "archivo completo",
      "Class": "EXTERNAL"
    },
    {
      "Path": "docs/adr/0017-validacion-cargas-diferida-ram-elements.md",
      "Section": "archivo completo",
      "Class": "EXTERNAL"
    }
  ],
  "AllowedWriteScope": [
    "src/RackCad.Application/Systems/Cantilever/CantileverStructuralModelSource.cs",
    "src/RackCad.Application/StructuralAnalysis/",
    "tests/RackCad.Tests/StructuralAnalysis/"
  ],
  "ForbiddenWriteScope": [
    "src/RackCad.Application/StructuralAnalysis/Providers/",
    "tests/RackCad.Tests/StructuralAnalysis/StructuralAnalysisCanonicalizerTests.cs",
    "tests/RackCad.Tests/StructuralAnalysis/StructuralAnalysisFingerprintTests.cs",
    "tests/RackCad.Tests/StructuralAnalysis/StructuralAnalysisLoadFileReaderTests.cs",
    "tests/RackCad.Tests/StructuralAnalysis/StructuralAnalysisMaterialProfileTests.cs",
    "tests/RackCad.Tests/StructuralAnalysis/StructuralAnalysisModelBuilderTests.cs",
    "tests/RackCad.Tests/StructuralAnalysis/StructuralAnalysisModelTests.cs",
    "tests/RackCad.Tests/StructuralAnalysis/StructuralAnalysisOutcomeTests.cs",
    "tests/RackCad.Tests/StructuralAnalysis/StructuralAnalysisSourceGuardTests.cs",
    "tests/RackCad.Tests/StructuralAnalysis/StructuralAnalysisUnitTests.cs",
    "src/RackCad.Application/Systems/Dynamic/",
    "src/RackCad.Application/Systems/FlowBed/",
    "src/RackCad.Application/Systems/Larguero/",
    "src/RackCad.Application/Systems/PushBack/",
    "src/RackCad.Application/Systems/Selective/",
    "src/RackCad.Application/Systems/Shared/",
    "src/RackCad.Application/Units/",
    "src/RackCad.Application/StructuralSections/",
    "src/RackCad.Application/RackCad.Application.csproj",
    "src/RackCad.Application/Persistence/",
    "src/RackCad.Application/Expressions/",
    "src/RackCad.Application/ComputedParameters/",
    "src/RackCad.Application/Catalogs/",
    "src/RackCad.Application/Bom/",
    "src/RackCad.Application/Geometry/",
    "src/RackCad.Application/Workspace/",
    "src/RackCad.Domain/",
    "src/RackCad.Plugin/",
    "src/RackCad.UI/",
    "tests/RackCad.UI.Tests/",
    "tests/RackCad.Tests/RackCad.Tests.csproj",
    "tests/RackCad.Tests/CantileverSourceGuardTests.cs",
    "tests/RackCad.Tests/CantileverRoundTwoSourceGuardTests.cs",
    "tests/RackCad.Tests/CantileverPluginSourceGuardTests.cs",
    "tests/RackCad.Tests/LengthUnitsAuthorityGuardTests.cs",
    "tests/RackCad.Tests/NamespaceFolderGuardTests.cs",
    "tests/RackCad.Tests/Fixtures/",
    "tests/RackCad.Tests/Golden/",
    "tests/RackCad.Tests/ComputedParameters/",
    "assets/",
    "deploy/",
    "eng/",
    "tools/",
    ".github/",
    "RackCad.sln",
    "Directory.Build.props",
    "Directory.Build.targets",
    "global.json",
    "NuGet.Config",
    ".gitattributes",
    ".gitignore",
    ".editorconfig",
    "AGENTS.md",
    "CLAUDE.md",
    "README.md",
    "docs/"
  ],
  "Invariants": [
    "INV-06 e IDL-01..08 (golden de CD-I65-F1-15, docs/initiatives/I-65-f1-ref-cant-01.md seccion 3): de REF-CANT-01 (estacion 0) la fuente Cantilever con BuildStructuralModel produce un modelo Valid con EXACTAMENTE los nudos COL.FOOT (0, -6.1, 0.25), ARM.1.PositiveY.J (0, -6.1, 20.26716169689737), ARM.2.PositiveY.J (0, -6.1, 48.267161696897375), ARM.3.PositiveY.J (0, -6.1, 76.26716169689738), COL.TOP (0, -6.1, 90.75), ARM.1.PositiveY.TIP (0, 36.22609804415268, 21.810300688090436), ARM.2.PositiveY.TIP (0, 36.22609804415268, 49.81030068809044) y ARM.3.PositiveY.TIP (0, 36.22609804415268, 77.81030068809044), tolerancia 1e-9 in; miembros COL.1..COL.4 (columna partida en los nudos J, de abajo arriba) y ARM.1.PositiveY, ARM.2.PositiveY y ARM.3.PositiveY (de J a TIP) con las secciones, roles, piezas de origen y vectores de peralte de esa tabla (tolerancia 1e-12); los literales se copian de la tabla y no se recalculan; las colocaciones resueltas de entrada (seccion 2 del mismo documento) se comprueban tambien como literales; nudos en puntos de insercion de bloque o en caras hacen fallar la prueba",
    "IDL-01..08 (reglas): eje analitico = eje centroidal (origen del marco de PrismaticSectionInstance mas eje longitudinal), nunca la geometria de bloque; COL.FOOT en el inicio fisico de la columna (z = ColumnStartZ); COL.TOP en su fin fisico; ARM.<nivel>.<lado>.J = interseccion en el plano Y-Z del eje del brazo prolongado con el eje de la columna; ARM.<nivel>.<lado>.TIP = eje del brazo en su fin fisico; sin offsets rigidos; base no modelada (SUP-02); IDL-08: fusion de nudos 0.001 in, separacion minima entre nudos de la columna 0.05 in (menor -> Invalid, sin fusion silenciosa), desviacion de un eje respecto del plano de la estacion 0.01 in (mayor -> Unsupported), angular 0.01 grados, nudo J fuera de COL.FOOT-COL.TOP -> Invalid",
    "D-04 (sistema neutral): coordenadas del sistema local de la estacion (datum CantileverColumnBaseDatum, antes del desplazamiento de linea OriginX: la estacion 1 del mismo diseno da las mismas coordenadas locales que la 0), dextrogiro, Z arriba, pulgadas por cantidades tipadas; solo estaciones de una cara PositiveY",
    "INV-07 (parte neutral de F1): el vector del eje de peralte de cada miembro se deriva del marco de su PrismaticSectionInstance incluidos RotationRadians y Mirrored; prueba con colocaciones sinteticas de giro 0, 90 y 12.3456 grados, con y sin espejo, cuyo oraculo es PrismaticSectionInstance.SectionTransform aplicado a la direccion local de peralte; una rotacion no nula ignorada hace fallar la prueba. La regla de ejes locales del programa de analisis y el giro emitido son de F3",